{
  "id": "since-us",
  "name": "Since Us",
  "tagline": "Count your time together and never miss an anniversary or special day.",
  "description": "How long have you been together? Since Us shows you at a glance, with your favorite photo.\n\nYour time together: days, weeks, months and hours since you got together. Live mode even counts every second.\n\nNever miss a special day: reminders for monthly and yearly anniversaries, round numbers like 100 or 500 days and fun numbers like 222, at a time you choose.\n\nYour moments: keep your first date, first kiss or first trip with a note and a photo, and get reminded every year.\n\nWidgets: a love card with your names and days together, or a compact counter in your phone's colors.\n\nPrivate: no account, no ads, no tracking. All data stays on your phone. English and German. Free and open source (GPL-3.0).",
  "repo": "https://github.com/DerDieDasLian/sinceus",
  "category": "social",
  "license": "SEE-REPO",
  "icon": "https://raw.githubusercontent.com/DerDieDasLian/sinceus/main/fastlane/metadata/android/en-US/images/icon.png",
  "screenshots": [
    "https://raw.githubusercontent.com/DerDieDasLian/sinceus/main/fastlane/metadata/android/en-US/images/phoneScreenshots/1.jpg%0Ahttps://raw.githubusercontent.com/DerDieDasLian/sinceus/main/fastlane/metadata/android/en-US/images/phoneScreenshots/2.jpg%0Ahttps://raw.githubusercontent.com/DerDieDasLian/sinceus/main/fastlane/metadata/android/en-US/images/phoneScreenshots/3.jpg%0Ahttps://raw.githubusercontent.com/DerDieDasLian/sinceus/main/fastlane/metadata/android/en-US/images/phoneScreenshots/4.jpg"
  ],
  "website": "https://derdiedaslian.github.io/sinceus/",
  "tags": [
    "couple",
    "relationship",
    "love",
    "anniversary",
    "days together",
    "counter",
    "widget",
    "reminder",
    "moments"
  ],
  "added": "2026-10-01"
}
